link,published,title,detailed
https://www.sueddeutsche.de/sport/hannover-heldt-trennung-1.4402820,"Tue, 09 Apr 2019 11:56:31 GMT","Entlassung von Horst Heldt: ""Hannover 96 benötigt einen Neuanfang""","Der abstiegsbedrohte Klub reagiert: Hannover wirft Manager Heldt raus - Vereinsboss Kind hält ihm vor, die Mannschaft schlecht zusammengestellt zu haben. "
https://www.sueddeutsche.de/sport/draisaitl-eishockey-nhl-1.4401122,"Tue, 09 Apr 2019 11:51:48 GMT",NHL: Draisaitl gehört nun zum höchsten Eishockey-Adel,Das gab's noch nie: Nationalstürmer Leon Draisaitl schießt in der NHL so viele Tore wie kein Deutscher vor ihm - trotzdem ärgert sich sein Klub vor den Playoffs.
https://www.sueddeutsche.de/politik/tuerkei-istanbul-wahl-1.4402944,"Tue, 09 Apr 2019 11:48:05 GMT",Bürgermeisterwahl: AKP will Wahlwiederholung in Istanbul,"Die Regierungspartei hatte zunächst eine vollständige Neuauszählung der Stimmen gefordert, was die Wahlbehörde ablehnte. Erdoğans Partei will nicht aufgeben. "
https://www.sueddeutsche.de/digital/passwort-it-sicherheit-gesetz-seehofer-beugehaft-gefaengnis-1.4401627,"Tue, 09 Apr 2019 11:44:32 GMT",Geplantes IT-Sicherheitsgesetz: Passwort oder Beugehaft,"Polizisten sollen laut einem Gesetzentwurf von Innenminister Seehofer im Netz die Konten Verdächtiger übernehmen dürfen. Wer sein Passwort nicht verrät, dem würden dann harte Sanktionen drohen.
"
https://www.sueddeutsche.de/sport/fussball-medien-metzelder-in-gespraechen-mit-leipzig-1.4402823,"Tue, 09 Apr 2019 11:36:06 GMT",Fußball: Medien: Metzelder in Gesprächen mit Leipzig,"Der ehemalige Nationalspieler könnte ""Leiter Sport"" werden. Der FC Chelsea rückt in England auf Platz drei und die Virginia Cavaliers sind Meister im US-College-Basketball."
https://www.sueddeutsche.de/muenchen/starnberg/starnberg-gasthof-au-biergarten-1.4401195,"Tue, 09 Apr 2019 11:21:07 GMT",Gastronomie: Bangen um den letzten Biergarten in Starnberg,"Das Wirtspaar des Gasthofs in der Au kündigt seinem Miteigentümer, mit dem die Eheleute eine Gesellschaft gegründet hatten. Ein Stadtrat will das Lokal retten."
https://www.sueddeutsche.de/politik/brexit-gipfel-may-barnier-leadsom-1.4402776,"Tue, 09 Apr 2019 11:17:00 GMT",Brexit: May sucht Unterstützer für Fristverlängerung,Die britische Premierministerin wirbt am Tag vor dem EU-Sondergipfel erst bei der Kanzlerin und dann beim französischen Präsidenten für einen Brexit-Aufschub. Auch in London wird weiter um Kompromisse gerungen. Mays Parlamentsbeauftragte macht einen unbeliebten Vorschlag. 
https://www.sueddeutsche.de/muenchen/fluechtlinge-gueterzug-brenner-1.4402855,"Tue, 09 Apr 2019 11:06:31 GMT",Laim: Sieben Flüchtlinge verstecken sich auf Güterzug,"Am Güterbahnhof München-Laim greift die Polizei eine Gruppe Nigerianer auf, die auf einem Zug über den Brenner gefahren sind. Unter ihnen sind auch drei Kinder."
https://www.sueddeutsche.de/panorama/fahrrad-infrastruktur-ranking-hof-1.4402631,"Tue, 09 Apr 2019 11:04:14 GMT","Fahrradfreundlichkeit: ""Da ist Nachholbedarf da""","Der Fahrradclub ADFC hat Fahrradfahrer in 700 Städten befragt, wie zufrieden sie mit der Situation in ihren Städten sind. Ein Anruf bei Harald Fichtner - dem Bürgermeister der Stadt, die am schlechtesten abgeschnitten hat: das bayerische Hof."
https://www.sueddeutsche.de/auto/fahrradklima-index-umfrage-adfc-1.4401790,"Tue, 09 Apr 2019 11:02:23 GMT",Fahrradklima-Index des ADFC: Radler geben deutschen Städten schlechte Noten,"Angesichts mangelhafter Infrastruktur fühlen sich Fahrradfahrer zunehmend unsicher. Bremen schnitt bei großen Städten am besten ab, Münster ist seine Spitzenstellung bei den kleineren los. "
https://www.sueddeutsche.de/muenchen/landkreismuenchen/universitaet-der-bundeswehr-kleine-einheiten-grosse-wirkung-1.4401925,"Tue, 09 Apr 2019 10:42:50 GMT","Universität der Bundeswehr: Kleine Einheiten, große Wirkung",Vier junge Forscher in Neubiberg wollen die Technik von Batteriespeichern revolutionieren. Durch die Aufteilung in eigenständige Module soll die Effizienz erhöht und die Störungsanfälligkeit gesenkt werden.
https://www.sueddeutsche.de/panorama/fruehjahrsputz-checkliste-wann-profis-1.4398158,"Tue, 09 Apr 2019 10:40:27 GMT",Frühjahrsputz: Putzen wie ein Profi,"Die einen polieren täglich jede Oberfläche, den anderen reicht es, mal durchzufegen. Wie viel Sauberkeit ist sinnvoll? Ein Mikrobiologe und eine Hauswirtschaftsmeisterin geben eine Anleitung in sieben Schritten."
https://www.sueddeutsche.de/politik/leserdiskussion-konditionalitaet-der-richtige-weg-fuer-die-eu-1.4402675,"Tue, 09 Apr 2019 10:39:12 GMT",Leserdiskussion: Konditionalität: Der richtige Weg für die EU?,"EU-Haushaltskommissar Günther Oettinger schlägt vor: Das Budget für die Jahre 2021 bis 2027 soll so gestaltet werden, dass die Auszahlung der Fördergelder an die Einhaltung rechtsstaatlicher Prinzipien geknüpft wird. Ungarn, Polen und Rumänien würde das hart treffen."
https://www.sueddeutsche.de/muenchen/gartenstaedte-menterschwaige-wohnblock-prozess-verwaltungsgericht-1.4401128,"Tue, 09 Apr 2019 10:22:30 GMT",Menterschwaige: Kampf um die Gartenstädte - eine Idylle verschwindet,"Eine Villa im Grünen soll abgerissen und durch ein riesiges Mehrfamilienhaus ersetzt werden. Der Stadt sind die Pläne zu massiv, doch vor Gericht hat sie verloren."
https://www.sueddeutsche.de/politik/is-prozess-muenchen-1.4402663,"Tue, 09 Apr 2019 10:16:14 GMT",Terrorismus: Jennifer W. wegen Mordes durch Unterlassen angeklagt,W. soll als Terroristin im Irak eine Fünfjährige und ihre Mutter als Sklavinnen gehalten und dem Kind beim Verdursten zugesehen haben. Dreh- und Angelpunkt des Verfahrens wird die Aussage der Mutter. 
